{
  "planVersion": 2,
  "specId": "SPEC-0001",
  "proofPurpose": "phase-1.5-compatibility-synthetic",
  "authorizationId": "phase-1.5-compatibility-synthetic/v1",
  "baseCommit": "8b663d2b80144e9aeba9ea0ecf0f78ccefa78926",
  "dirtyExpectedPaths": [
    "scripts/fixtures/spec0001-browser/v2/phase-1.5-compatibility-action-registry.json",
    "scripts/fixtures/spec0001-browser/v2/phase-1.5-compatibility-browser-plan.json",
    "scripts/fixtures/spec0001-browser/v2/phase-1.5-compatibility-closeout.schema.json",
    "scripts/fixtures/spec0001-browser/v2/phase-1.5-compatibility-negative-cases.json",
    "scripts/fixtures/spec0001-browser/v2/phase-1.5-compatibility-proof-commands.json",
    "scripts/fixtures/spec0001-browser/v2/phase-1.5-compatibility-proof-manifest.schema.json",
    "scripts/fixtures/spec0001-browser/v2/tester-extension-authorization.schema.json",
    "scripts/fixtures/spec0001-browser/v2/tester-extension-authorizations.json",
    "scripts/fixtures/spec0001-browser/v2/tester-extension-plan.schema.json",
    "scripts/fixtures/spec0001-browser/v2/tester-extension-registry.schema.json",
    "scripts/fixtures/spec0001-browser/v2/tester-extension-result.schema.json",
    "scripts/fixtures/stick-ai/v1/proof-command-receipt-v2.schema.json",
    "scripts/fixtures/stick-ai/v1/proof-manifest-v2.schema.json",
    "scripts/recordSpec0001ProofBundle.ts",
    "scripts/runSpec0001BrowserProof.ts",
    "scripts/spec0001-browser/actions/phase15CompatibilitySynthetic.ts",
    "scripts/spec0001-browser/browserTesterExtensionContract.ts",
    "scripts/spec0001-browser/finalizePhase15CompatibilityCloseout.ts",
    "scripts/spec0001-browser/recordPhase15CompatibilityProof.ts",
    "scripts/spec0001-browser/validatePhase15Compatibility.ts",
    "scripts/spec0001-browser/validatePhase15CompatibilityProof.ts",
    "scripts/spec0001-proof/measureSpec0001LintRegression.ts",
    "scripts/validateSpec0001ProofBundle.ts"
  ],
  "cleanExpectedPaths": [],
  "outputRoot": "output/spec-0001/phase-1.5-compatibility",
  "operationFamilies": ["checkpoint", "fixture", "pointer", "protected-regression", "runner-environment", "screenshot", "visible-role", "visible-testid", "workspace-driver"],
  "registry": {
    "path": "scripts/fixtures/spec0001-browser/v2/phase-1.5-compatibility-action-registry.json",
    "byteLength": 8459,
    "sha256": "sha256:8823071ed0663897464f1ee842820b91dda44667261dc0b06207ab2028bf8d35"
  },
  "contexts": [
    {"contextId": "synthetic-1024x768", "viewport": {"width": 1024, "height": 768}}
  ],
  "steps": [
    {"stepId": "01-environment-install", "actionId": "environment-install", "contextId": "synthetic-1024x768"},
    {"stepId": "02-fixture-mount", "actionId": "fixture-mount", "contextId": "synthetic-1024x768"},
    {"stepId": "03-checkpoint-after-mount", "actionId": "checkpoint-after-mount", "contextId": "synthetic-1024x768"},
    {"stepId": "04-manual-ready-position", "actionId": "manual-ready-position", "contextId": "synthetic-1024x768"},
    {"stepId": "05-manual-inward-pose", "actionId": "manual-inward-pose", "contextId": "synthetic-1024x768"},
    {"stepId": "06-manual-outward-pose", "actionId": "manual-outward-pose", "contextId": "synthetic-1024x768"},
    {"stepId": "07-drag-down", "actionId": "drag-down", "contextId": "synthetic-1024x768"},
    {"stepId": "08-drag-move", "actionId": "drag-move", "contextId": "synthetic-1024x768"},
    {"stepId": "09-drag-up", "actionId": "drag-up", "contextId": "synthetic-1024x768"},
    {"stepId": "10-cancel-down", "actionId": "cancel-down", "contextId": "synthetic-1024x768"},
    {"stepId": "11-cancel-move", "actionId": "cancel-move", "contextId": "synthetic-1024x768"},
    {"stepId": "12-cancel-terminal", "actionId": "cancel-terminal", "contextId": "synthetic-1024x768"},
    {"stepId": "13-publication-begin-a", "actionId": "publication-begin-a", "contextId": "synthetic-1024x768"},
    {"stepId": "14-publication-begin-b", "actionId": "publication-begin-b", "contextId": "synthetic-1024x768"},
    {"stepId": "15-publication-complete-b", "actionId": "publication-complete-b", "contextId": "synthetic-1024x768"},
    {"stepId": "16-publication-complete-a", "actionId": "publication-complete-a", "contextId": "synthetic-1024x768"},
    {"stepId": "17-environment-release", "actionId": "environment-release", "contextId": "synthetic-1024x768"},
    {"stepId": "18-environment-checkpoint", "actionId": "environment-checkpoint", "contextId": "synthetic-1024x768"},
    {"stepId": "19-workspace-checkpoint", "actionId": "workspace-checkpoint", "contextId": "synthetic-1024x768"},
    {"stepId": "20-evidence-checkpoint", "actionId": "evidence-checkpoint", "contextId": "synthetic-1024x768"},
    {"stepId": "21-compatibility-screenshot", "actionId": "compatibility-screenshot", "contextId": "synthetic-1024x768"},
    {"stepId": "22-regression-home-new-drawing", "actionId": "regression-home-new-drawing", "contextId": "synthetic-1024x768"},
    {"stepId": "23-regression-home-new-stick", "actionId": "regression-home-new-stick", "contextId": "synthetic-1024x768"},
    {"stepId": "24-regression-stick-creator-back", "actionId": "regression-stick-creator-back", "contextId": "synthetic-1024x768"},
    {"stepId": "25-regression-drawing-generate", "actionId": "regression-drawing-generate", "contextId": "synthetic-1024x768"},
    {"stepId": "26-regression-drawing-controls", "actionId": "regression-drawing-controls", "contextId": "synthetic-1024x768"},
    {"stepId": "27-environment-clear", "actionId": "environment-clear", "contextId": "synthetic-1024x768"}
  ],
  "evidence": {
    "ledgerKinds": ["action", "checkpoint", "cleanup", "console", "negative", "network", "regression", "request", "storage"],
    "screenshotIds": ["phase-1.5-compatibility"],
    "protectedRegressionGroups": ["drawing-generate-frames", "drawing-undo-redo-play-pause", "home-new-drawing", "home-new-stick", "stick-creator-back"],
    "productPhaseClaimed": false
  }
}
