{
  "planVersion": 2,
  "specId": "SPEC-0001",
  "proofPurpose": "phase-2",
  "authorizationId": "phase-2/v1",
  "baseCommit": "1f9746a6188e5e13aca1fbd62bea2e1e27bba627",
  "dirtyExpectedPaths": [
    "scripts/fixtures/spec0001-browser/v1/phase-2-action-registry.json",
    "scripts/fixtures/spec0001-browser/v2/tester-extension-authorizations.json",
    "scripts/fixtures/stick-ai/v1/phase-2-browser-proof-plan.json",
    "scripts/fixtures/stick-ai/v1/phase-2-proof-commands.json",
    "scripts/fixtures/stick-ai/v1/stick-editable-timeline-alias-cases.json",
    "scripts/fixtures/stick-ai/v1/stick-editable-timeline-cases.json",
    "scripts/fixtures/stick-ai/v1/stick-ui-restoration-reference.json",
    "scripts/recordSpec0001ProofBundle.ts",
    "scripts/spec0001-browser/actions/phase2.ts",
    "scripts/spec0001-browser/browserTesterExtensionContract.ts",
    "scripts/validateSpec0001ProofBundle.ts",
    "scripts/validateStickPoseTimeline.ts",
    "src/components/workspace/stickfigure/StickFigureCanvas.tsx",
    "src/components/workspace/stickfigure/StickFigureRightPanel.tsx",
    "src/components/workspace/stickfigure/StickFigureTimelineRow.tsx",
    "src/components/workspace/stickfigure/StickFigureToolBar.tsx",
    "src/components/workspace/stickfigure/StickFigureTopBar.tsx",
    "src/components/workspace/stickfigure/StickFigureWorkspace.tsx",
    "src/components/workspace/stickfigure/types.ts",
    "src/lib/stickfigure/stickTimeline.ts"
  ],
  "cleanExpectedPaths": [],
  "outputRoot": "output/spec-0001/phase-2-ui-restoration-correction",
  "operationFamilies": [
    "checkpoint",
    "fixture",
    "pointer",
    "protected-regression",
    "runner-environment",
    "screenshot",
    "visible-role",
    "visible-testid",
    "workspace-driver"
  ],
  "registry": {
    "path": "scripts/fixtures/spec0001-browser/v1/phase-2-action-registry.json",
    "byteLength": 3975,
    "sha256": "sha256:79f56fc452727deda15285a332c2d3f684dba5ad8f721a2df423a286ce687cf1"
  },
  "contexts": [
    {"contextId": "synthetic-1024x768", "viewport": {"width": 1024, "height": 768}}
  ],
  "steps": [
    {"stepId": "001-compact-stage", "actionId": "compact-stick-stage", "contextId": "synthetic-1024x768"},
    {"stepId": "002-compact-frame", "actionId": "compact-fresh-frame", "contextId": "synthetic-1024x768"},
    {"stepId": "003-compact-fresh", "actionId": "compact-fresh", "contextId": "synthetic-1024x768"},
    {"stepId": "004-compact-tools", "actionId": "compact-open-tools", "contextId": "synthetic-1024x768"},
    {"stepId": "005-compact-creator-enabled", "actionId": "compact-creator-enabled", "contextId": "synthetic-1024x768"},
    {"stepId": "006-compact-open-creator", "actionId": "compact-open-creator", "contextId": "synthetic-1024x768"},
    {"stepId": "007-compact-save-disabled", "actionId": "compact-creator-save-disabled", "contextId": "synthetic-1024x768"},
    {"stepId": "008-compact-back", "actionId": "compact-creator-back", "contextId": "synthetic-1024x768"},
    {"stepId": "009-compact-returned", "actionId": "compact-returned-stage", "contextId": "synthetic-1024x768"},
    {"stepId": "010-compact-after", "actionId": "compact-after-creator", "contextId": "synthetic-1024x768"},
    {"stepId": "011-protect-drawing-generate", "actionId": "protect-drawing-generate", "contextId": "synthetic-1024x768"},
    {"stepId": "012-protect-drawing-history", "actionId": "protect-drawing-history-playback", "contextId": "synthetic-1024x768"},
    {"stepId": "013-protect-home-drawing", "actionId": "protect-home-new-drawing", "contextId": "synthetic-1024x768"},
    {"stepId": "014-protect-home-stick", "actionId": "protect-home-new-stick", "contextId": "synthetic-1024x768"},
    {"stepId": "015-protect-stick-creator", "actionId": "protect-stick-creator-back", "contextId": "synthetic-1024x768"}
  ],
  "evidence": {
    "ledgerKinds": ["action", "checkpoint", "cleanup", "console", "negative", "network", "regression", "request", "storage"],
    "screenshotIds": ["compact-01-fresh-stick", "compact-02-stick-after-creator"],
    "protectedRegressionGroups": ["drawing-generate-frames", "drawing-undo-redo-play-pause", "home-new-drawing", "home-new-stick", "stick-creator-back"],
    "productPhaseClaimed": true
  }
}
